{
  "schema_version": "0.1",
  "session_id": "mig-20260604-dead01",
  "generated_at": "2026-06-03T19:59:26.774Z",
  "acquisition_phase": 3,
  "url_plan": [
    {
      "snapshot_id": "mig-20260604-dead01-ws001",
      "competitor_id": "mig-20260604-dead01-c001",
      "requested_url": "https://manipulator-krd.ru/",
      "page_role": "homepage"
    },
    {
      "snapshot_id": "mig-20260604-dead01-ws002",
      "competitor_id": "mig-20260604-dead01-c002",
      "requested_url": "https://kran-logistik.ru/uslugi",
      "page_role": "homepage"
    }
  ],
  "snapshots": [
    {
      "snapshot_id": "mig-20260604-dead01-ws001",
      "session_id": "mig-20260604-dead01",
      "competitor_id": "mig-20260604-dead01-c001",
      "domain": "manipulator-krd.ru",
      "requested_url": "https://manipulator-krd.ru/",
      "final_url": "https://manipulator-krd.ru/",
      "page_role": "homepage",
      "capture_time": "2026-06-03T19:59:26.774Z",
      "status": "failed",
      "acquisition_method": "http_get_dom",
      "http_status": null,
      "redirect_chain": [],
      "content_type": null,
      "charset": null,
      "render_status": "unknown",
      "fetch_duration_ms": 87,
      "title": null,
      "meta_description": null,
      "canonical_url": null,
      "lang": null,
      "headings": [],
      "contacts": {
        "phones": [],
        "emails": [],
        "addresses": [],
        "messengers": []
      },
      "offers": [],
      "pricing_signals": [],
      "cta_elements": [],
      "forms": [],
      "links": {
        "internal": [],
        "external": []
      },
      "trust_signals_visible": [],
      "visible_text_excerpt": null,
      "artifact_refs": {
        "website_snapshot": "snapshots/sites/mig-20260604-dead01-ws001/website_snapshot.json",
        "page_html": "snapshots/sites/mig-20260604-dead01-ws001/page.html",
        "headers": "snapshots/sites/mig-20260604-dead01-ws001/headers.json"
      },
      "evidence_grade": "X",
      "safe_unknown": [
        "Fetch error: fetch failed"
      ]
    },
    {
      "snapshot_id": "mig-20260604-dead01-ws002",
      "session_id": "mig-20260604-dead01",
      "competitor_id": "mig-20260604-dead01-c002",
      "domain": "kran-logistik.ru",
      "requested_url": "https://kran-logistik.ru/uslugi",
      "final_url": "https://kran-logistik.ru/uslugi",
      "page_role": "homepage",
      "capture_time": "2026-06-03T19:59:26.774Z",
      "status": "failed",
      "acquisition_method": "http_get_dom",
      "http_status": null,
      "redirect_chain": [],
      "content_type": null,
      "charset": null,
      "render_status": "unknown",
      "fetch_duration_ms": 5,
      "title": null,
      "meta_description": null,
      "canonical_url": null,
      "lang": null,
      "headings": [],
      "contacts": {
        "phones": [],
        "emails": [],
        "addresses": [],
        "messengers": []
      },
      "offers": [],
      "pricing_signals": [],
      "cta_elements": [],
      "forms": [],
      "links": {
        "internal": [],
        "external": []
      },
      "trust_signals_visible": [],
      "visible_text_excerpt": null,
      "artifact_refs": {
        "website_snapshot": "snapshots/sites/mig-20260604-dead01-ws002/website_snapshot.json",
        "page_html": "snapshots/sites/mig-20260604-dead01-ws002/page.html",
        "headers": "snapshots/sites/mig-20260604-dead01-ws002/headers.json"
      },
      "evidence_grade": "X",
      "safe_unknown": [
        "Fetch error: fetch failed"
      ]
    }
  ],
  "session_coverage": "minimal",
  "section_evidence_grade": "X",
  "safe_unknown": [
    "Website capture partial: 1 competitor(s) skipped (see url_plan)"
  ]
}
